{
  "id": "AAMkAGI2THVSAAA=",
  "blobId": "blob-AAMkAGI2THVSAAA=",
  "threadId": "AAQkAGI2TAABj5P2QAAA=",
  "messageId": ["<CABcD1E2FgH3IjK4LmN5OpQ6RsT7UvW8XyZ9@mail.company.com>"],
  "inReplyTo": ["<CAAbC9D8EfG7HiJ6KlM4NnO3PpQ2RrS1TuV0WxY8@mail.example.com>"],
  "references": ["<CAAbC9D8EfG7HiJ6KlM4NnO3PpQ2RrS1TuV0WxY8@mail.example.com>"],
  "from": [
    {
      "name": "Sarah Smith",
      "email": "sarah.smith@company.com"
    }
  ],
  "to": [
    {
      "name": "John Doe",
      "email": "john.doe@example.com"
    }
  ],
  "cc": [
    {
      "name": "Jane Admin",
      "email": "jane.admin@example.com"
    }
  ],
  "bcc": null,
  "replyTo": null,
  "subject": "Follow-up: Q4 Report Request",
  "sentAt": "2023-11-09T20:00:00Z",
  "receivedAt": "2023-11-09T20:00:15Z",
  "size": 183,
  "preview": "Hi John, Just wanted to follow up on our meeting yesterday. Can you send over the Q4 report when you get a chance? Thanks, Sarah",
  "hasAttachment": false,
  "attachmentCount": 0,
  "keywords": {
    "$seen": true,
    "$flagged": false,
    "$draft": false
  },
  "labels": ["Work", "Important"],
  "importance": "normal"
}
